id,title,description,coverImage,releaseYear,genres,status
1,One Piece (2025 Arc),"The Straw Hat Pirates continue their adventure in the New World with exciting new challenges and allies in this 2025 continuation of the beloved series.","https://images.unsplash.com/photo-1578662996442-48f60103fc96?w=400&h=600&fit=crop","2025","Action,Adventure,Comedy","ongoing"
2,Attack on Titan: Final Season Part 4,"The epic conclusion to the Attack on Titan saga brings the story of Eren Yeager and the Survey Corps to its dramatic end.","https://images.unsplash.com/photo-1578662996442-48f60103fc96?w=400&h=600&fit=crop","2025","Action,Drama,Fantasy","completed"
3,Demon Slayer: Infinity Castle Arc,"Tanjiro and his friends face their greatest challenge yet as they infiltrate the Infinity Castle to confront the Upper Moons.","https://images.unsplash.com/photo-1578662996442-48f60103fc96?w=400&h=600&fit=crop","2025","Action,Supernatural,Historical","ongoing"
4,My Hero Academia Season 8,"The next generation of heroes faces new threats as society continues to evolve in this continuation of the popular superhero series.","https://images.unsplash.com/photo-1578662996442-48f60103fc96?w=400&h=600&fit=crop","2025","Action,Superhero,School","ongoing"
5,Jujutsu Kaisen Season 3,"The Shibuya Incident continues with devastating consequences for the world of jujutsu sorcerers.","https://images.unsplash.com/photo-1578662996442-48f60103fc96?w=400&h=600&fit=crop","2025","Action,Supernatural,School","upcoming"