id,animeId,visualRating,musicRating,cuteRating,reviewText,reviewerName,createdAt
1,1,9,8,7,"One Piece continues to deliver stunning animation and epic storytelling. The visual effects in the latest arc are absolutely breathtaking!","AnimeExpert2025","2025-01-15T10:30:00Z"
2,1,8,9,6,"The soundtrack in this arc is phenomenal! Each battle scene is perfectly complemented by the music. Truly a masterpiece.","MusicLover123","2025-01-16T14:20:00Z"
3,2,10,9,5,"Attack on Titan's final season delivers on every front. The animation quality is movie-level and the story conclusion is satisfying.","TitanFan","2025-02-01T09:15:00Z"
4,2,9,8,4,"Incredible finale to an incredible series. The visual storytelling and emotional impact are unmatched.","EpicAnime","2025-02-02T16:45:00Z"
5,3,9,10,8,"Demon Slayer's animation continues to set the bar high. The Infinity Castle arc is visually stunning and the characters are adorable!","SlayerReviewer","2025-03-10T11:00:00Z"
6,4,8,7,9,"My Hero Academia keeps getting better! The new characters are so cute and the action sequences are well-animated.","HeroFan2025","2025-03-15T13:30:00Z"
7,5,10,9,7,"Jujutsu Kaisen's upcoming season looks promising based on the trailers. Can't wait to see the Shibuya Incident animated!","JJKLover","2025-04-01T08:00:00Z"